{
  "$schema": "https://json-schema.org/draft/2020-12/schema",
  "$id": "https://ai-production-director.local/schemas/prompt-ast-v2.json",
  "type": "object",
  "additionalProperties": false,
  "required": [
    "schema_version",
    "prompt_id",
    "prompt_revision",
    "brief_hash",
    "model",
    "parameters",
    "blocks"
  ],
  "properties": {
    "schema_version": {
      "const": "2.0"
    },
    "prompt_id": {
      "type": "string",
      "minLength": 1
    },
    "prompt_revision": {
      "type": "integer",
      "minimum": 1
    },
    "brief_hash": {
      "type": "string",
      "pattern": "^[a-f0-9]{64}$"
    },
    "model": {
      "type": "string",
      "minLength": 1
    },
    "parameters": {
      "type": "object"
    },
    "blocks": {
      "type": "array",
      "minItems": 1,
      "items": {
        "type": "object",
        "additionalProperties": false,
        "required": [
          "id",
          "segments"
        ],
        "properties": {
          "id": {
            "type": "string",
            "minLength": 1
          },
          "segments": {
            "type": "array",
            "minItems": 1,
            "items": {
              "type": "object",
              "additionalProperties": false,
              "required": [
                "id",
                "kind",
                "source_rules"
              ],
              "properties": {
                "id": {
                  "type": "string",
                  "minLength": 1
                },
                "kind": {
                  "enum": [
                    "brief_template",
                    "rule_text",
                    "adapter_text"
                  ]
                },
                "template": {
                  "type": "string"
                },
                "text": {
                  "type": "string"
                },
                "bindings": {
                  "type": "object",
                  "additionalProperties": {
                    "type": "string"
                  }
                },
                "source_rules": {
                  "type": "array",
                  "items": {
                    "type": "string"
                  },
                  "uniqueItems": true
                }
              }
            }
          }
        }
      }
    }
  }
}