{
  "schema_version": "2.0",
  "prompt_id": "tennis-editorial-001",
  "prompt_revision": 1,
  "brief_hash": "6fccf59b4ab00f6fac7c11be5b350141304875b1067de538f78feae95393b365",
  "model": "Nano Banana Pro",
  "parameters": {
    "aspectRatio": "16:9"
  },
  "blocks": [
    {
      "id": "scene",
      "segments": [
        {
          "id": "deliverable",
          "kind": "brief_template",
          "template": "Create a wide {deliverable} at {location} on {surface}.",
          "bindings": {
            "deliverable": "deliverable",
            "location": "environment.location",
            "surface": "environment.surface"
          },
          "source_rules": []
        }
      ]
    },
    {
      "id": "subject",
      "segments": [
        {
          "id": "identity",
          "kind": "brief_template",
          "template": "A {sex} {sport} player, approximately {age} years old.",
          "bindings": {
            "sex": "subject.sex",
            "sport": "subject.sport",
            "age": "subject.age_range"
          },
          "source_rules": []
        }
      ]
    },
    {
      "id": "composition",
      "segments": [
        {
          "id": "camera",
          "kind": "brief_template",
          "template": "Use a {camera} with a {perspective}.",
          "bindings": {
            "camera": "composition.camera",
            "perspective": "composition.perspective"
          },
          "source_rules": []
        },
        {
          "id": "player",
          "kind": "brief_template",
          "template": "The player is {position}, captured in a {action}.",
          "bindings": {
            "position": "composition.player_position",
            "action": "composition.action"
          },
          "source_rules": []
        },
        {
          "id": "racket_ball",
          "kind": "brief_template",
          "template": "Keep the {racket_ball}.",
          "bindings": {
            "racket_ball": "composition.racket_ball"
          },
          "source_rules": []
        },
        {
          "id": "legs",
          "kind": "brief_template",
          "template": "His stance: {legs}.",
          "bindings": {
            "legs": "composition.legs"
          },
          "source_rules": []
        },
        {
          "id": "depth",
          "kind": "brief_template",
          "template": "Show {court_depth}.",
          "bindings": {
            "court_depth": "composition.court_depth"
          },
          "source_rules": []
        },
        {
          "id": "net",
          "kind": "brief_template",
          "template": "{net_visibility}.",
          "bindings": {
            "net_visibility": "composition.net_visibility"
          },
          "source_rules": []
        }
      ]
    },
    {
      "id": "background",
      "segments": [
        {
          "id": "wall",
          "kind": "brief_template",
          "template": "The {wall_relation}, with {stands}, {focus}.",
          "bindings": {
            "wall_relation": "environment.wall_relation",
            "stands": "environment.stands",
            "focus": "environment.crowd_focus"
          },
          "source_rules": []
        }
      ]
    },
    {
      "id": "look",
      "segments": [
        {
          "id": "look",
          "kind": "brief_template",
          "template": "{expression}, {anatomy}, {clay}, {photography}.",
          "bindings": {
            "expression": "look.expression",
            "anatomy": "look.anatomy",
            "clay": "look.clay",
            "photography": "look.photography"
          },
          "source_rules": []
        }
      ]
    }
  ]
}